[
  {
    "id": "ioc-self-invocation",
    "topic": "ioc",
    "difficulty": 3,
    "elo": 1100,
    "type": "code",
    "prompt": "Wat gebeurt er als serviceA() @Transactional is en serviceB() vanuit dezelfde class serviceA() aanroept?",
    "code": "@Service\npublic class OrderService {\n  @Transactional\n  public void serviceA() { /* ... */ }\n\n  public void serviceB() {\n    serviceA(); // self-invocation\n  }\n}",
    "choices": [
      { "id": "a", "text": "Er start altijd een nieuwe transactie via de Spring-proxy." },
      { "id": "b", "text": "De @Transactional-proxy wordt omzeild; er is geen transactionele wrapping." },
      { "id": "c", "text": "Spring gooit een SelfInvocationException." },
      { "id": "d", "text": "Alleen read-only mode wordt toegepast." }
    ],
    "answer": "b",
    "explanation": "Self-invocation gaat via this, niet via de proxy. @Transactional (en @Async/@Cacheable) werken dan niet.",
    "trap": "Veel ontwikkelaars denken dat annotaties altijd ‘magisch’ werken, ook bij interne calls."
  },
  {
    "id": "tx-checked-exception",
    "topic": "transactions",
    "difficulty": 3,
    "elo": 1050,
    "type": "single",
    "prompt": "Default @Transactional-gedrag bij een checked Exception die uit de methode bubbelt?",
    "choices": [
      { "id": "a", "text": "Rollback" },
      { "id": "b", "text": "Commit (geen rollback)" },
      { "id": "c", "text": "Spring wrapt altijd naar RuntimeException" },
      { "id": "d", "text": "Alleen rollback als de Exception een message heeft" }
    ],
    "answer": "b",
    "explanation": "Default rollback alleen bij RuntimeException/Error. Checked exceptions committen, tenzij rollbackFor is gezet.",
    "trap": "In de praktijk voeg je vaak rollbackFor = Exception.class toe — op het examen telt de default."
  },
  {
    "id": "boot-component-scan",
    "topic": "boot",
    "difficulty": 2,
    "elo": 950,
    "type": "single",
    "prompt": "Waar scant @SpringBootApplication standaard naar componenten?",
    "choices": [
      { "id": "a", "text": "Alleen in spring.factories" },
      { "id": "b", "text": "Vanaf het package van de @SpringBootApplication-class (en subpackages)" },
      { "id": "c", "text": "Het hele classpath zonder beperking" },
      { "id": "d", "text": "Alleen classes met @RestController" }
    ],
    "answer": "b",
    "explanation": "@SpringBootApplication bevat @ComponentScan met base package = package van de annotated class.",
    "trap": "Controllers in een sibling-package van de Application-class worden zo makkelijk ‘vergeten’."
  },
  {
    "id": "aop-advice-order",
    "topic": "aop",
    "difficulty": 4,
    "elo": 1200,
    "type": "single",
    "prompt": "Twee @Aspect beans zonder @Order. Wat is de advice-volgorde?",
    "choices": [
      { "id": "a", "text": "Alfabetisch op classnaam" },
      { "id": "b", "text": "Undefined / niet gegarandeerd" },
      { "id": "c", "text": "Around altijd eerst, daarna Before" },
      { "id": "d", "text": "De aspect die het laatst geladen is, wint altijd" }
    ],
    "answer": "b",
    "explanation": "Zonder Ordered/@Order is de volgorde tussen aspects niet gedefinieerd. Gebruik @Order voor determinisme.",
    "trap": "Menselijke aanname dat Spring ‘iets slims’ doet (alfabet of load-order)."
  },
  {
    "id": "mvc-restcontroller",
    "topic": "mvc",
    "difficulty": 1,
    "elo": 800,
    "type": "single",
    "prompt": "Wat is @RestController equivalent aan?",
    "choices": [
      { "id": "a", "text": "@Controller + @RequestMapping" },
      { "id": "b", "text": "@Controller + @ResponseBody" },
      { "id": "c", "text": "@Service + @ResponseBody" },
      { "id": "d", "text": "@Component + @GetMapping" }
    ],
    "answer": "b",
    "explanation": "@RestController = @Controller + @ResponseBody; return values gaan naar de response body.",
    "trap": "Verwarren met @RequestMapping, dat alleen de mapping beschrijft."
  },
  {
    "id": "testing-mockbean",
    "topic": "testing",
    "difficulty": 3,
    "elo": 1120,
    "type": "single",
    "prompt": "Wat is het verschil tussen @MockBean en @Mock + @InjectMocks?",
    "choices": [
      { "id": "a", "text": "Geen verschil; aliases" },
      { "id": "b", "text": "@MockBean vervangt een bean in de Spring-context; @Mock/@InjectMocks is puur Mockito" },
      { "id": "c", "text": "@Mock laadt altijd de volle ApplicationContext" },
      { "id": "d", "text": "@MockBean werkt alleen met @WebMvcTest, niet met @SpringBootTest" }
    ],
    "answer": "b",
    "explanation": "@MockBean is Spring Boot-test support en vervangt/registreert een mock in de context. @Mock + @InjectMocks raakt de context niet.",
    "trap": "Beide ‘mocken’, maar alleen @MockBean beïnvloedt wiring in integratie-/slice-tests."
  },
  {
    "id": "boot-property-precedence",
    "topic": "boot",
    "difficulty": 4,
    "elo": 1250,
    "type": "single",
    "prompt": "Welke bron wint bij gelijke property-keys?",
    "choices": [
      { "id": "a", "text": "application.properties" },
      { "id": "b", "text": "application-{profile}.properties" },
      { "id": "c", "text": "Command-line argument (--key=value)" },
      { "id": "d", "text": "@Value default in code" }
    ],
    "answer": "c",
    "explanation": "Command-line args zitten hoog in de PropertySource-volgorde en overschrijven file-based properties.",
    "trap": "Profile-files voelen ‘specifieker’, maar CLI/env zitten nog hoger."
  },
  {
    "id": "security-csrf-rest",
    "topic": "security",
    "difficulty": 2,
    "elo": 1000,
    "type": "single",
    "prompt": "Voor een pure JSON REST API zonder browser-forms: CSRF meestal?",
    "choices": [
      { "id": "a", "text": "Verplicht aan laten; anders start Spring niet" },
      { "id": "b", "text": "Vaak uitzetten; CSRF beschermt vooral browser cookie-sessies bij forms" },
      { "id": "c", "text": "Alleen relevant bij GET-requests" },
      { "id": "d", "text": "Vervangen door HTTP Basic" }
    ],
    "answer": "b",
    "explanation": "CSRF is cruciaal bij cookie-based browser flows. Stateless token APIs zetten CSRF vaak uit — ken de trade-off voor het examen.",
    "trap": "‘Security altijd maximaliseren’ zonder te weten wáár CSRF tegen beschermt."
  },
  {
    "id": "ioc-qualifier-primary",
    "topic": "ioc",
    "difficulty": 3,
    "elo": 1080,
    "type": "single",
    "prompt": "Twee beans van hetzelfde type: één @Primary, injectie met @Qualifier(\"other\"). Welke bean?",
    "choices": [
      { "id": "a", "text": "De @Primary bean" },
      { "id": "b", "text": "De bean met naam/qualifier \"other\"" },
      { "id": "c", "text": "NoUniqueBeanDefinitionException" },
      { "id": "d", "text": "Altijd de eerst geregistreerde bean" }
    ],
    "answer": "b",
    "explanation": "@Qualifier selecteert expliciet; @Primary geldt alleen als er geen specifiekere selectie is.",
    "trap": "@Primary voelt als ‘winnaar’, maar qualifier is gerichter."
  },
  {
    "id": "testing-webmvctest",
    "topic": "testing",
    "difficulty": 2,
    "elo": 980,
    "type": "single",
    "prompt": "Wat laadt @WebMvcTest standaard níet?",
    "choices": [
      { "id": "a", "text": "Spring MVC infrastructure en de gespecificeerde controller" },
      { "id": "b", "text": "De volle ApplicationContext inclusief alle @Service/@Repository beans" },
      { "id": "c", "text": "MockMvc" },
      { "id": "d", "text": "Jackson message converters" }
    ],
    "answer": "b",
    "explanation": "@WebMvcTest is een slice: web layer. Services/repositories mock je (bijv. @MockBean), anders ontbreken ze.",
    "trap": "Verwarren met @SpringBootTest dat wél de (bijna) volle context start."
  }
]
